{
    "$id": "materials-category/defects/two-dimensional/slab-grain-boundary/configuration",
    "$schema": "http://json-schema.org/draft-07/schema#",
    "title": "Slab Grain Boundary Configuration Schema",
    "description": "Configuration for a grain boundary between two phases with different surfaces facing each other",
    "type": "object",
    "required": [
        "phase_1_configuration",
        "phase_2_configuration",
        "phase_1_termination",
        "phase_2_termination",
        "slab_configuration"
    ],
    "properties": {
        "phase_1_configuration": {
            "description": "The configuration of the first phase",
            "$ref": "../../../single_material/two_dimensional/slab/configuration.json"
        },
        "phase_2_configuration": {
            "description": "The configuration of the second phase",
            "$ref": "../../../single_material/two_dimensional/slab/configuration.json"
        },
        "phase_1_termination": {
            "description": "The termination of the first phase",
            "$ref": "../../../../material/reusable/slab/termination.json"
        },
        "phase_2_termination": {
            "description": "The termination of the second phase",
            "$ref": "../../../../material/reusable/slab/termination.json"
        },
        "gap": {
            "description": "The gap between the two phases, in Angstroms",
            "type": "number",
            "default": 3.0
        },
        "slab_configuration": {
            "description": "The configuration of the grain boundary slab",
            "$ref": "../../../single_material/two_dimensional/slab/configuration.json"
        },
        "slab_termination": {
            "description": "The termination of the grain boundary slab",
            "$ref": "../../../../material/reusable/slab/termination.json"
        }
    }
} 
